14:22:31.051814 IP localhost.45890 > localhost.50000: Flags [S], seq 3743400745, win 43690, options [mss 65495,sackOK,TS val 110980951 ecr 0,nop,wscale 7], length 0
14:22:31.051827 IP localhost.50000 > localhost.45890: Flags [R.], seq 0, ack 3743400746, win 0, length 0
14:22:32.252911 IP6 ip6-localhost.46938 > ip6-localhost.ipp: Flags [S], seq 3076032385, win 43690, options [mss 65476,sackOK,TS val 110981252 ecr 0,nop,wscale 7], length 0
14:22:32.252926 IP6 ip6-localhost.ipp > ip6-localhost.46938: Flags [S.], seq 2365654647, ack 3076032386, win 43690, options [mss 65476,sackOK,TS val 110981252 ecr 110981252,nop,wscale 7], length 0
14:22:32.252954 IP6 ip6-localhost.46938 > ip6-localhost.ipp: Flags [.], ack 1, win 342, options [nop,nop,TS val 110981252 ecr 110981252], length 0
14:22:32.253022 IP6 ip6-localhost.46938 > ip6-localhost.ipp: Flags [P.], seq 1:181, ack 1, win 342, options [nop,nop,TS val 110981252 ecr 110981252], length 180
14:22:32.253028 IP6 ip6-localhost.ipp > ip6-localhost.46938: Flags [.], ack 181, win 350, options [nop,nop,TS val 110981252 ecr 110981252], length 0
14:22:32.253040 IP6 ip6-localhost.46938 > ip6-localhost.ipp: Flags [P.], seq 181:562, ack 1, win 342, options [nop,nop,TS val 110981252 ecr 110981252], length 381
14:22:32.253043 IP6 ip6-localhost.ipp > ip6-localhost.46938: Flags [.], ack 562, win 359, options [nop,nop,TS val 110981252 ecr 110981252], length 0
14:22:32.253084 IP6 ip6-localhost.ipp > ip6-localhost.46938: Flags [P.], seq 1:26, ack 562, win 359, options [nop,nop,TS val 110981252 ecr 110981252], length 25
14:22:32.253102 IP6 ip6-localhost.46938 > ip6-localhost.ipp: Flags [.], ack 26, win 342, options [nop,nop,TS val 110981252 ecr 110981252], length 0
14:22:32.253642 IP6 ip6-localhost.ipp > ip6-localhost.46938: Flags [P.], seq 26:348, ack 562, win 359, options [nop,nop,TS val 110981252 ecr 110981252], length 322
14:22:32.253650 IP6 ip6-localhost.46938 > ip6-localhost.ipp: Flags [.], ack 348, win 350, options [nop,nop,TS val 110981252 ecr 110981252], length 0
14:22:32.253670 IP6 ip6-localhost.ipp > ip6-localhost.46938: Flags [P.], seq 348:1652, ack 562, win 359, options [nop,nop,TS val 110981252 ecr 110981252], length 1304
14:22:32.253682 IP6 ip6-localhost.46938 > ip6-localhost.ipp: Flags [.], ack 1652, win 1373, options [nop,nop,TS val 110981252 ecr 110981252], length 0
14:22:32.253846 IP6 ip6-localhost.46938 > ip6-localhost.ipp: Flags [F.], seq 562, ack 1652, win 1373, options [nop,nop,TS val 110981252 ecr 110981252], length 0
14:22:32.253903 IP6 ip6-localhost.ipp > ip6-localhost.46938: Flags [F.], seq 1652, ack 563, win 359, options [nop,nop,TS val 110981252 ecr 110981252], length 0
14:22:32.253909 IP6 ip6-localhost.46938 > ip6-localhost.ipp: Flags [.], ack 1653, win 1373, options [nop,nop,TS val 110981252 ecr 110981252], length 0
14:22:36.467640 IP localhost.45277 > localhost.2345: UDP, length 15
14:22:36.467657 IP localhost.45277 > localhost.2345: UDP, length 15
14:22:36.467661 IP localhost.45277 > localhost.2345: UDP, length 15
14:22:36.467669 IP localhost.45277 > localhost.2345: UDP, length 15
14:22:36.467676 IP localhost.45277 > localhost.2345: UDP, length 15
14:22:36.467682 IP localhost.45277 > localhost.2345: UDP, length 15
14:22:36.467689 IP localhost.45277 > localhost.2345: UDP, length 15
14:22:36.467695 IP localhost.45277 > localhost.2345: UDP, length 15
14:22:36.467701 IP localhost.45277 > localhost.2345: UDP, length 15
14:22:36.467707 IP localhost.45277 > localhost.2345: UDP, length 15
14:22:36.467712 IP localhost.45277 > localhost.2345: UDP, length 15
14:22:36.467717 IP localhost.45277 > localhost.2345: UDP, length 15
14:22:36.467721 IP localhost.45277 > localhost.2345: UDP, length 15
14:22:36.467726 IP localhost.45277 > localhost.2345: UDP, length 15
14:22:36.467731 IP localhost.45277 > localhost.2345: UDP, length 15
14:22:36.467736 IP localhost.45277 > localhost.2345: UDP, length 15
14:22:36.467741 IP localhost.45277 > localhost.2345: UDP, length 15
14:22:36.467746 IP localhost.45277 > localhost.2345: UDP, length 15
14:22:36.467751 IP localhost.45277 > localhost.2345: UDP, length 15
14:22:36.467755 IP localhost.45277 > localhost.2345: UDP, length 15
14:22:36.467760 IP localhost.45277 > localhost.2345: UDP, length 15
14:22:36.467765 IP localhost.45277 > localhost.2345: UDP, length 15
14:22:36.467770 IP localhost.45277 > localhost.2345: UDP, length 15
14:22:36.467775 IP localhost.45277 > localhost.2345: UDP, length 15
14:22:36.467780 IP localhost.45277 > localhost.2345: UDP, length 15
14:22:36.467785 IP localhost.45277 > localhost.2345: UDP, length 15
14:22:36.467790 IP localhost.45277 > localhost.2345: UDP, length 15
14:22:36.467795 IP localhost.45277 > localhost.2345: UDP, length 15
14:22:36.467799 IP localhost.45277 > localhost.2345: UDP, length 15
14:22:36.467804 IP localhost.45277 > localhost.2345: UDP, length 15
14:22:36.467809 IP localhost.45277 > localhost.2345: UDP, length 15
14:22:36.467814 IP localhost.45277 > localhost.2345: UDP, length 15
14:22:36.467820 IP localhost.45277 > localhost.2345: UDP, length 15
14:22:36.467826 IP localhost.45277 > localhost.2345: UDP, length 15
14:22:36.467829 IP localhost.45277 > localhost.2345: UDP, length 15
14:22:36.467836 IP localhost.45277 > localhost.2345: UDP, length 15
14:22:36.467844 IP localhost.45277 > localhost.2345: UDP, length 15
14:22:36.467848 IP localhost.45277 > localhost.2345: UDP, length 15
14:22:36.467851 IP localhost.45277 > localhost.2345: UDP, length 15
14:22:36.467859 IP localhost.45277 > localhost.2345: UDP, length 15
14:22:36.467863 IP localhost.45277 > localhost.2345: UDP, length 15
14:22:36.467866 IP localhost.45277 > localhost.2345: UDP, length 15
14:22:36.467869 IP localhost.45277 > localhost.2345: UDP, length 15
14:22:36.467876 IP localhost.45277 > localhost.2345: UDP, length 15
14:22:36.467880 IP localhost.45277 > localhost.2345: UDP, length 15
14:22:36.467883 IP localhost.45277 > localhost.2345: UDP, length 15
14:22:36.467886 IP localhost.45277 > localhost.2345: UDP, length 15
14:22:36.467894 IP localhost.45277 > localhost.2345: UDP, length 15
14:22:36.467897 IP localhost.45277 > localhost.2345: UDP, length 15
14:22:36.467900 IP localhost.45277 > localhost.2345: UDP, length 15
14:22:36.467904 IP localhost.45277 > localhost.2345: UDP, length 15
14:22:36.467910 IP localhost.45277 > localhost.2345: UDP, length 15
14:22:36.467913 IP localhost.45277 > localhost.2345: UDP, length 15
14:22:36.467917 IP localhost.45277 > localhost.2345: UDP, length 15
14:22:36.467920 IP localhost.45277 > localhost.2345: UDP, length 15
14:22:36.467924 IP localhost.45277 > localhost.2345: UDP, length 15
14:22:36.467927 IP localhost.45277 > localhost.2345: UDP, length 15
14:22:36.467930 IP localhost.45277 > localhost.2345: UDP, length 15
14:22:36.467934 IP localhost.45277 > localhost.2345: UDP, length 15
14:22:36.467937 IP localhost.45277 > localhost.2345: UDP, length 15
14:22:36.467940 IP localhost.45277 > localhost.2345: UDP, length 15
14:22:36.467943 IP localhost.45277 > localhost.2345: UDP, length 15
14:22:36.467947 IP localhost.45277 > localhost.2345: UDP, length 15
14:22:36.467950 IP localhost.45277 > localhost.2345: UDP, length 15
14:22:36.467953 IP localhost.45277 > localhost.2345: UDP, length 15
14:22:36.467957 IP localhost.45277 > localhost.2345: UDP, length 15
14:22:36.467960 IP localhost.45277 > localhost.2345: UDP, length 15
14:22:36.467963 IP localhost.45277 > localhost.2345: UDP, length 15
14:22:36.467966 IP localhost.45277 > localhost.2345: UDP, length 15
14:22:36.467969 IP localhost.45277 > localhost.2345: UDP, length 15
14:22:36.467972 IP localhost.45277 > localhost.2345: UDP, length 15
14:22:36.467976 IP localhost.45277 > localhost.2345: UDP, length 15
14:22:36.467979 IP localhost.45277 > localhost.2345: UDP, length 15
14:22:36.467982 IP localhost.45277 > localhost.2345: UDP, length 15
14:22:36.467986 IP localhost.45277 > localhost.2345: UDP, length 15
14:22:36.467989 IP localhost.45277 > localhost.2345: UDP, length 15
14:22:36.467992 IP localhost.45277 > localhost.2345: UDP, length 15
14:22:36.467995 IP localhost.45277 > localhost.2345: UDP, length 15
14:22:36.468002 IP localhost.45277 > localhost.2345: UDP, length 15
14:22:36.468007 IP localhost.45277 > localhost.2345: UDP, length 15
14:22:36.468010 IP localhost.45277 > localhost.2345: UDP, length 15
14:22:36.468013 IP localhost.45277 > localhost.2345: UDP, length 15
14:22:36.468019 IP localhost.45277 > localhost.2345: UDP, length 15
14:22:36.468023 IP localhost.45277 > localhost.2345: UDP, length 15
14:22:36.468026 IP localhost.45277 > localhost.2345: UDP, length 15
14:22:36.468029 IP localhost.45277 > localhost.2345: UDP, length 15
14:22:36.468035 IP localhost.45277 > localhost.2345: UDP, length 15
14:22:36.468038 IP localhost.45277 > localhost.2345: UDP, length 15
14:22:36.468042 IP localhost.45277 > localhost.2345: UDP, length 15
14:22:36.468045 IP localhost.45277 > localhost.2345: UDP, length 15
14:22:36.468051 IP localhost.45277 > localhost.2345: UDP, length 15
14:22:36.468055 IP localhost.45277 > localhost.2345: UDP, length 15
14:22:36.468058 IP localhost.45277 > localhost.2345: UDP, length 15
14:22:36.468062 IP localhost.45277 > localhost.2345: UDP, length 15
14:22:36.468068 IP localhost.45277 > localhost.2345: UDP, length 15
14:22:36.468071 IP localhost.45277 > localhost.2345: UDP, length 15
14:22:36.468075 IP localhost.45277 > localhost.2345: UDP, length 15
14:22:36.468078 IP localhost.45277 > localhost.2345: UDP, length 15
14:22:36.468081 IP localhost.45277 > localhost.2345: UDP, length 15
14:22:36.468085 IP localhost.45277 > localhost.2345: UDP, length 15
14:22:36.468088 IP localhost.45277 > localhost.2345: UDP, length 15
14:22:36.468092 IP localhost.45277 > localhost.2345: UDP, length 15
14:22:36.468095 IP localhost.45277 > localhost.2345: UDP, length 15
14:22:36.468098 IP localhost.45277 > localhost.2345: UDP, length 15
14:22:36.468102 IP localhost.45277 > localhost.2345: UDP, length 15
14:22:36.468105 IP localhost.45277 > localhost.2345: UDP, length 15
14:22:36.468108 IP localhost.45277 > localhost.2345: UDP, length 15
14:22:36.468111 IP localhost.45277 > localhost.2345: UDP, length 15
14:22:36.468115 IP localhost.45277 > localhost.2345: UDP, length 15
14:22:36.468120 IP localhost.45277 > localhost.2345: UDP, length 15
14:22:36.468124 IP localhost.45277 > localhost.2345: UDP, length 15
14:22:36.468127 IP localhost.45277 > localhost.2345: UDP, length 15
14:22:36.468130 IP localhost.45277 > localhost.2345: UDP, length 15
14:22:36.468136 IP localhost.45277 > localhost.2345: UDP, length 15
14:22:36.468140 IP localhost.45277 > localhost.2345: UDP, length 15
14:22:36.468143 IP localhost.45277 > localhost.2345: UDP, length 15
14:22:36.468146 IP localhost.45277 > localhost.2345: UDP, length 15
14:22:36.468149 IP localhost.45277 > localhost.2345: UDP, length 15
14:22:36.468153 IP localhost.45277 > localhost.2345: UDP, length 15
14:22:36.468156 IP localhost.45277 > localhost.2345: UDP, length 15
14:22:36.468160 IP localhost.45277 > localhost.2345: UDP, length 15
14:22:36.468163 IP localhost.45277 > localhost.2345: UDP, length 15
14:22:36.468166 IP localhost.45277 > localhost.2345: UDP, length 15
14:22:36.468169 IP localhost.45277 > localhost.2345: UDP, length 15
14:22:36.468173 IP localhost.45277 > localhost.2345: UDP, length 15
14:22:36.468176 IP localhost.45277 > localhost.2345: UDP, length 15
14:22:36.468179 IP localhost.45277 > localhost.2345: UDP, length 15
14:22:36.468183 IP localhost.45277 > localhost.2345: UDP, length 15
14:22:36.468186 IP localhost.45277 > localhost.2345: UDP, length 15
14:22:36.468189 IP localhost.45277 > localhost.2345: UDP, length 15
14:22:36.468193 IP localhost.45277 > localhost.2345: UDP, length 15
14:22:36.468196 IP localhost.45277 > localhost.2345: UDP, length 15
14:22:36.468199 IP localhost.45277 > localhost.2345: UDP, length 15
14:22:36.468205 IP localhost.45277 > localhost.2345: UDP, length 15
14:22:36.468209 IP localhost.45277 > localhost.2345: UDP, length 15
14:22:36.468212 IP localhost.45277 > localhost.2345: UDP, length 15
14:22:36.468216 IP localhost.45277 > localhost.2345: UDP, length 15
14:22:36.468222 IP localhost.45277 > localhost.2345: UDP, length 15
14:22:36.468227 IP localhost.45277 > localhost.2345: UDP, length 15
14:22:36.468232 IP localhost.45277 > localhost.2345: UDP, length 15
14:22:36.468236 IP localhost.45277 > localhost.2345: UDP, length 15
14:22:36.468241 IP localhost.45277 > localhost.2345: UDP, length 15
14:22:36.468246 IP localhost.45277 > localhost.2345: UDP, length 15
14:22:36.468252 IP localhost.45277 > localhost.2345: UDP, length 15
14:22:36.468256 IP localhost.45277 > localhost.2345: UDP, length 15
14:22:36.468261 IP localhost.45277 > localhost.2345: UDP, length 15
14:22:36.468266 IP localhost.45277 > localhost.2345: UDP, length 15
14:22:36.468270 IP localhost.45277 > localhost.2345: UDP, length 15
14:22:36.468275 IP localhost.45277 > localhost.2345: UDP, length 15
14:22:36.468280 IP localhost.45277 > localhost.2345: UDP, length 15
14:22:36.468284 IP localhost.45277 > localhost.2345: UDP, length 15
14:22:36.468289 IP localhost.45277 > localhost.2345: UDP, length 15
14:22:36.468294 IP localhost.45277 > localhost.2345: UDP, length 15
14:22:36.468299 IP localhost.45277 > localhost.2345: UDP, length 15
14:22:36.468304 IP localhost.45277 > localhost.2345: UDP, length 15
14:22:36.468308 IP localhost.45277 > localhost.2345: UDP, length 15
14:22:36.468313 IP localhost.45277 > localhost.2345: UDP, length 15
14:22:36.468317 IP localhost.45277 > localhost.2345: UDP, length 15
14:22:36.468322 IP localhost.45277 > localhost.2345: UDP, length 15
14:22:36.468326 IP localhost.45277 > localhost.2345: UDP, length 15
14:22:36.468331 IP localhost.45277 > localhost.2345: UDP, length 15
14:22:36.468336 IP localhost.45277 > localhost.2345: UDP, length 15
14:22:36.468340 IP localhost.45277 > localhost.2345: UDP, length 15
14:22:36.468345 IP localhost.45277 > localhost.2345: UDP, length 15
14:22:36.468349 IP localhost.45277 > localhost.2345: UDP, length 15
14:22:36.468354 IP localhost.45277 > localhost.2345: UDP, length 15
14:22:36.468359 IP localhost.45277 > localhost.2345: UDP, length 15
14:22:36.468363 IP localhost.45277 > localhost.2345: UDP, length 15
14:22:36.468368 IP localhost.45277 > localhost.2345: UDP, length 15
14:22:36.468373 IP localhost.45277 > localhost.2345: UDP, length 15
14:22:36.468378 IP localhost.45277 > localhost.2345: UDP, length 15
14:22:36.468383 IP localhost.45277 > localhost.2345: UDP, length 15
14:22:36.468386 IP localhost.45277 > localhost.2345: UDP, length 15
14:22:36.468390 IP localhost.45277 > localhost.2345: UDP, length 15
14:22:36.468393 IP localhost.45277 > localhost.2345: UDP, length 15
14:22:36.468397 IP localhost.45277 > localhost.2345: UDP, length 15
14:22:36.468400 IP localhost.45277 > localhost.2345: UDP, length 15
14:22:36.468403 IP localhost.45277 > localhost.2345: UDP, length 15
14:22:36.468406 IP localhost.45277 > localhost.2345: UDP, length 15
14:22:36.468410 IP localhost.45277 > localhost.2345: UDP, length 15
14:22:36.468413 IP localhost.45277 > localhost.2345: UDP, length 15
14:22:36.468416 IP localhost.45277 > localhost.2345: UDP, length 15
14:22:36.468419 IP localhost.45277 > localhost.2345: UDP, length 15
14:22:36.468423 IP localhost.45277 > localhost.2345: UDP, length 15
14:22:36.468426 IP localhost.45277 > localhost.2345: UDP, length 15
14:22:36.468429 IP localhost.45277 > localhost.2345: UDP, length 15
14:22:36.468432 IP localhost.45277 > localhost.2345: UDP, length 15
14:22:36.468435 IP localhost.45277 > localhost.2345: UDP, length 15
14:22:36.468439 IP localhost.45277 > localhost.2345: UDP, length 15
14:22:36.468442 IP localhost.45277 > localhost.2345: UDP, length 15
14:22:36.468446 IP localhost.45277 > localhost.2345: UDP, length 15
14:22:36.468452 IP localhost.45277 > localhost.2345: UDP, length 15
14:22:36.468456 IP localhost.45277 > localhost.2345: UDP, length 15
14:22:36.468459 IP localhost.45277 > localhost.2345: UDP, length 15
14:22:36.468462 IP localhost.45277 > localhost.2345: UDP, length 15
14:22:36.468465 IP localhost.45277 > localhost.2345: UDP, length 15
14:22:36.468469 IP localhost.45277 > localhost.2345: UDP, length 15
14:22:36.468472 IP localhost.45277 > localhost.2345: UDP, length 15
14:22:36.468475 IP localhost.45277 > localhost.2345: UDP, length 15
14:22:36.468479 IP localhost.45277 > localhost.2345: UDP, length 15
14:22:36.468482 IP localhost.45277 > localhost.2345: UDP, length 15
14:22:36.468485 IP localhost.45277 > localhost.2345: UDP, length 15
14:22:36.468488 IP localhost.45277 > localhost.2345: UDP, length 15
14:22:36.468492 IP localhost.45277 > localhost.2345: UDP, length 15
14:22:36.468495 IP localhost.45277 > localhost.2345: UDP, length 15
14:22:36.468498 IP localhost.45277 > localhost.2345: UDP, length 15
14:22:36.468502 IP localhost.45277 > localhost.2345: UDP, length 15
14:22:36.468505 IP localhost.45277 > localhost.2345: UDP, length 15
14:22:36.468508 IP localhost.45277 > localhost.2345: UDP, length 15
14:22:36.468512 IP localhost.45277 > localhost.2345: UDP, length 15
14:22:36.468515 IP localhost.45277 > localhost.2345: UDP, length 15
14:22:36.468518 IP localhost.45277 > localhost.2345: UDP, length 15
14:22:36.468521 IP localhost.45277 > localhost.2345: UDP, length 15
14:22:36.468525 IP localhost.45277 > localhost.2345: UDP, length 15
14:22:36.468528 IP localhost.45277 > localhost.2345: UDP, length 15
14:22:36.468532 IP localhost.45277 > localhost.2345: UDP, length 15
14:22:36.468538 IP localhost.45277 > localhost.2345: UDP, length 15
14:22:36.468541 IP localhost.45277 > localhost.2345: UDP, length 15
14:22:36.468545 IP localhost.45277 > localhost.2345: UDP, length 15
14:22:36.468550 IP localhost.45277 > localhost.2345: UDP, length 15
14:22:36.468557 IP localhost.45277 > localhost.2345: UDP, length 15
14:22:36.468561 IP localhost.45277 > localhost.2345: UDP, length 15
14:22:36.468564 IP localhost.45277 > localhost.2345: UDP, length 15
14:22:36.468567 IP localhost.45277 > localhost.2345: UDP, length 15
14:22:36.468571 IP localhost.45277 > localhost.2345: UDP, length 15
14:22:36.468575 IP localhost.45277 > localhost.2345: UDP, length 15
14:22:36.468578 IP localhost.45277 > localhost.2345: UDP, length 15
14:22:36.468581 IP localhost.45277 > localhost.2345: UDP, length 15
14:22:36.468585 IP localhost.45277 > localhost.2345: UDP, length 15
14:22:36.468588 IP localhost.45277 > localhost.2345: UDP, length 15
14:22:36.468591 IP localhost.45277 > localhost.2345: UDP, length 15
14:22:36.468595 IP localhost.45277 > localhost.2345: UDP, length 15
14:22:36.468598 IP localhost.45277 > localhost.2345: UDP, length 15
14:22:36.468602 IP localhost.45277 > localhost.2345: UDP, length 15
14:22:36.468605 IP localhost.45277 > localhost.2345: UDP, length 15
14:22:36.468608 IP localhost.45277 > localhost.2345: UDP, length 15
14:22:36.468613 IP localhost.45277 > localhost.2345: UDP, length 15
14:22:36.468617 IP localhost.45277 > localhost.2345: UDP, length 15
14:22:36.468620 IP localhost.45277 > localhost.2345: UDP, length 15
14:22:36.468623 IP localhost.45277 > localhost.2345: UDP, length 15
14:22:36.468630 IP localhost.45277 > localhost.2345: UDP, length 15
14:22:36.468633 IP localhost.45277 > localhost.2345: UDP, length 15
14:22:36.468636 IP localhost.45277 > localhost.2345: UDP, length 15
14:22:36.468640 IP localhost.45277 > localhost.2345: UDP, length 15
14:22:36.468646 IP localhost.45277 > localhost.2345: UDP, length 15
14:22:36.468650 IP localhost.45277 > localhost.2345: UDP, length 15
14:22:36.468653 IP localhost.45277 > localhost.2345: UDP, length 15
14:22:36.468657 IP localhost.45277 > localhost.2345: UDP, length 15
14:22:36.468663 IP localhost.45277 > localhost.2345: UDP, length 15
14:22:36.468667 IP localhost.45277 > localhost.2345: UDP, length 15
14:22:36.468670 IP localhost.45277 > localhost.2345: UDP, length 15
14:22:36.468673 IP localhost.45277 > localhost.2345: UDP, length 15
14:22:36.468677 IP localhost.45277 > localhost.2345: UDP, length 15
14:22:36.468682 IP localhost.45277 > localhost.2345: UDP, length 15
14:22:36.468686 IP localhost.45277 > localhost.2345: UDP, length 15
14:22:36.468689 IP localhost.45277 > localhost.2345: UDP, length 15
14:22:36.468693 IP localhost.45277 > localhost.2345: UDP, length 15
14:22:36.468699 IP localhost.45277 > localhost.2345: UDP, length 15
14:22:36.468703 IP localhost.45277 > localhost.2345: UDP, length 15
14:22:36.468706 IP localhost.45277 > localhost.2345: UDP, length 15
14:22:36.468709 IP localhost.45277 > localhost.2345: UDP, length 15
14:22:36.468715 IP localhost.45277 > localhost.2345: UDP, length 15
14:22:36.468719 IP localhost.45277 > localhost.2345: UDP, length 15
14:22:36.468722 IP localhost.45277 > localhost.2345: UDP, length 15
14:22:36.468726 IP localhost.45277 > localhost.2345: UDP, length 15
14:22:36.468732 IP localhost.45277 > localhost.2345: UDP, length 15
14:22:36.468735 IP localhost.45277 > localhost.2345: UDP, length 15
14:22:36.468739 IP localhost.45277 > localhost.2345: UDP, length 15
14:22:36.468742 IP localhost.45277 > localhost.2345: UDP, length 15
14:22:36.468748 IP localhost.45277 > localhost.2345: UDP, length 15
14:22:36.468755 IP localhost.45277 > localhost.2345: UDP, length 15
14:22:36.468759 IP localhost.45277 > localhost.2345: UDP, length 15
14:22:36.468764 IP localhost.45277 > localhost.2345: UDP, length 15
14:22:36.468768 IP localhost.45277 > localhost.2345: UDP, length 15
14:22:36.468773 IP localhost.45277 > localhost.2345: UDP, length 15
14:22:36.468778 IP localhost.45277 > localhost.2345: UDP, length 15
14:22:36.468783 IP localhost.45277 > localhost.2345: UDP, length 15
14:22:36.468787 IP localhost.45277 > localhost.2345: UDP, length 15
14:22:36.468792 IP localhost.45277 > localhost.2345: UDP, length 15
14:22:36.468797 IP localhost.45277 > localhost.2345: UDP, length 15
14:22:36.468801 IP localhost.45277 > localhost.2345: UDP, length 15
14:22:36.468806 IP localhost.45277 > localhost.2345: UDP, length 15
14:22:36.468811 IP localhost.45277 > localhost.2345: UDP, length 15
14:22:36.468816 IP localhost.45277 > localhost.2345: UDP, length 15
14:22:36.468820 IP localhost.45277 > localhost.2345: UDP, length 15
14:22:36.468825 IP localhost.45277 > localhost.2345: UDP, length 15
14:22:36.468830 IP localhost.45277 > localhost.2345: UDP, length 15
14:22:36.468835 IP localhost.45277 > localhost.2345: UDP, length 15
14:22:36.468839 IP localhost.45277 > localhost.2345: UDP, length 15
14:22:36.468844 IP localhost.45277 > localhost.2345: UDP, length 15
14:22:36.468848 IP localhost.45277 > localhost.2345: UDP, length 15
14:22:36.468853 IP localhost.45277 > localhost.2345: UDP, length 15
14:22:36.468858 IP localhost.45277 > localhost.2345: UDP, length 15
14:22:36.468863 IP localhost.45277 > localhost.2345: UDP, length 15
14:22:36.468867 IP localhost.45277 > localhost.2345: UDP, length 15
14:22:36.468872 IP localhost.45277 > localhost.2345: UDP, length 15
14:22:36.468877 IP localhost.45277 > localhost.2345: UDP, length 15
14:22:36.468884 IP localhost.45277 > localhost.2345: UDP, length 15
14:22:36.468890 IP localhost.45277 > localhost.2345: UDP, length 15
14:22:36.468898 IP localhost.45277 > localhost.2345: UDP, length 15
14:22:36.468904 IP localhost.45277 > localhost.2345: UDP, length 15
14:22:36.468908 IP localhost.45277 > localhost.2345: UDP, length 15
14:22:36.468913 IP localhost.45277 > localhost.2345: UDP, length 15
14:22:36.468917 IP localhost.45277 > localhost.2345: UDP, length 15
14:22:36.468922 IP localhost.45277 > localhost.2345: UDP, length 15
14:22:36.468926 IP localhost.45277 > localhost.2345: UDP, length 15
14:22:36.468931 IP localhost.45277 > localhost.2345: UDP, length 15
14:22:36.468936 IP localhost.45277 > localhost.2345: UDP, length 15
14:22:36.468940 IP localhost.45277 > localhost.2345: UDP, length 15
14:22:36.468945 IP localhost.45277 > localhost.2345: UDP, length 15
14:22:36.468949 IP localhost.45277 > localhost.2345: UDP, length 15
14:22:36.468954 IP localhost.45277 > localhost.2345: UDP, length 15
14:22:36.468957 IP localhost.45277 > localhost.2345: UDP, length 15
14:22:36.468966 IP localhost.45277 > localhost.2345: UDP, length 15
14:22:36.468972 IP localhost.45277 > localhost.2345: UDP, length 15
14:22:36.468977 IP localhost.45277 > localhost.2345: UDP, length 15
14:22:36.468981 IP localhost.45277 > localhost.2345: UDP, length 15
14:22:36.468986 IP localhost.45277 > localhost.2345: UDP, length 15
14:22:36.468990 IP localhost.45277 > localhost.2345: UDP, length 15
14:22:36.468995 IP localhost.45277 > localhost.2345: UDP, length 15
14:22:36.468999 IP localhost.45277 > localhost.2345: UDP, length 15
14:22:36.469004 IP localhost.45277 > localhost.2345: UDP, length 15
14:22:36.469009 IP localhost.45277 > localhost.2345: UDP, length 15
14:22:36.469014 IP localhost.45277 > localhost.2345: UDP, length 15
14:22:36.469018 IP localhost.45277 > localhost.2345: UDP, length 15
14:22:36.469023 IP localhost.45277 > localhost.2345: UDP, length 15
14:22:36.469027 IP localhost.45277 > localhost.2345: UDP, length 15
14:22:36.469032 IP localhost.45277 > localhost.2345: UDP, length 15
14:22:36.469035 IP localhost.45277 > localhost.2345: UDP, length 15
14:22:36.469040 IP localhost.45277 > localhost.2345: UDP, length 15
14:22:36.469044 IP localhost.45277 > localhost.2345: UDP, length 15
14:22:36.469049 IP localhost.45277 > localhost.2345: UDP, length 15
14:22:36.469054 IP localhost.45277 > localhost.2345: UDP, length 15
14:22:36.469058 IP localhost.45277 > localhost.2345: UDP, length 15
14:22:36.469063 IP localhost.45277 > localhost.2345: UDP, length 15
14:22:36.469067 IP localhost.45277 > localhost.2345: UDP, length 15
14:22:36.469072 IP localhost.45277 > localhost.2345: UDP, length 15
14:22:36.469077 IP localhost.45277 > localhost.2345: UDP, length 15
14:22:36.469081 IP localhost.45277 > localhost.2345: UDP, length 15
14:22:36.469086 IP localhost.45277 > localhost.2345: UDP, length 15
14:22:36.469091 IP localhost.45277 > localhost.2345: UDP, length 15
14:22:36.469096 IP localhost.45277 > localhost.2345: UDP, length 15
14:22:36.469102 IP localhost.45277 > localhost.2345: UDP, length 15
14:22:36.469107 IP localhost.45277 > localhost.2345: UDP, length 15
14:22:36.469110 IP localhost.45277 > localhost.2345: UDP, length 15
14:22:36.469114 IP localhost.45277 > localhost.2345: UDP, length 15
14:22:36.469117 IP localhost.45277 > localhost.2345: UDP, length 15
14:22:36.469121 IP localhost.45277 > localhost.2345: UDP, length 15
14:22:36.469124 IP localhost.45277 > localhost.2345: UDP, length 15
14:22:36.469128 IP localhost.45277 > localhost.2345: UDP, length 15
14:22:36.469131 IP localhost.45277 > localhost.2345: UDP, length 15
14:22:36.469135 IP localhost.45277 > localhost.2345: UDP, length 15
14:22:36.469138 IP localhost.45277 > localhost.2345: UDP, length 15
14:22:36.469141 IP localhost.45277 > localhost.2345: UDP, length 15
14:22:36.469144 IP localhost.45277 > localhost.2345: UDP, length 15
14:22:36.469147 IP localhost.45277 > localhost.2345: UDP, length 15
14:22:36.469151 IP localhost.45277 > localhost.2345: UDP, length 15
14:22:36.469154 IP localhost.45277 > localhost.2345: UDP, length 15
14:22:36.469157 IP localhost.45277 > localhost.2345: UDP, length 15
14:22:36.469161 IP localhost.45277 > localhost.2345: UDP, length 15
14:22:36.469164 IP localhost.45277 > localhost.2345: UDP, length 15
14:22:36.469167 IP localhost.45277 > localhost.2345: UDP, length 15
14:22:36.469170 IP localhost.45277 > localhost.2345: UDP, length 15
14:22:36.469174 IP localhost.45277 > localhost.2345: UDP, length 15
14:22:36.469177 IP localhost.45277 > localhost.2345: UDP, length 15
14:22:36.469181 IP localhost.45277 > localhost.2345: UDP, length 15
14:22:36.469185 IP localhost.45277 > localhost.2345: UDP, length 15
14:22:36.469188 IP localhost.45277 > localhost.2345: UDP, length 15
14:22:36.469191 IP localhost.45277 > localhost.2345: UDP, length 15
14:22:36.469194 IP localhost.45277 > localhost.2345: UDP, length 15
14:22:36.469197 IP localhost.45277 > localhost.2345: UDP, length 15
14:22:36.469201 IP localhost.45277 > localhost.2345: UDP, length 15
14:22:36.469204 IP localhost.45277 > localhost.2345: UDP, length 15
14:22:36.469208 IP localhost.45277 > localhost.2345: UDP, length 15
14:22:36.469211 IP localhost.45277 > localhost.2345: UDP, length 15
14:22:36.469214 IP localhost.45277 > localhost.2345: UDP, length 15
14:22:36.469218 IP localhost.45277 > localhost.2345: UDP, length 15
14:22:36.469221 IP localhost.45277 > localhost.2345: UDP, length 15
14:22:36.469224 IP localhost.45277 > localhost.2345: UDP, length 15
14:22:36.469228 IP localhost.45277 > localhost.2345: UDP, length 15
14:22:36.469231 IP localhost.45277 > localhost.2345: UDP, length 15
14:22:36.469235 IP localhost.45277 > localhost.2345: UDP, length 15
14:22:36.469238 IP localhost.45277 > localhost.2345: UDP, length 15
14:22:36.469241 IP localhost.45277 > localhost.2345: UDP, length 15
14:22:36.469245 IP localhost.45277 > localhost.2345: UDP, length 15
14:22:36.469248 IP localhost.45277 > localhost.2345: UDP, length 15
14:22:36.469251 IP localhost.45277 > localhost.2345: UDP, length 15
14:22:36.469254 IP localhost.45277 > localhost.2345: UDP, length 15
14:22:36.469257 IP localhost.45277 > localhost.2345: UDP, length 15
14:22:36.469261 IP localhost.45277 > localhost.2345: UDP, length 15
14:22:36.469264 IP localhost.45277 > localhost.2345: UDP, length 15
14:22:36.469267 IP localhost.45277 > localhost.2345: UDP, length 15
14:22:36.469271 IP localhost.45277 > localhost.2345: UDP, length 15
14:22:36.469274 IP localhost.45277 > localhost.2345: UDP, length 15
14:22:36.469277 IP localhost.45277 > localhost.2345: UDP, length 15
14:22:36.469280 IP localhost.45277 > localhost.2345: UDP, length 15
14:22:36.469283 IP localhost.45277 > localhost.2345: UDP, length 15
14:22:36.469287 IP localhost.45277 > localhost.2345: UDP, length 15
14:22:36.469290 IP localhost.45277 > localhost.2345: UDP, length 15
14:22:36.469293 IP localhost.45277 > localhost.2345: UDP, length 15
14:22:36.469296 IP localhost.45277 > localhost.2345: UDP, length 15
14:22:36.469299 IP localhost.45277 > localhost.2345: UDP, length 15
14:22:36.469302 IP localhost.45277 > localhost.2345: UDP, length 15
14:22:36.469306 IP localhost.45277 > localhost.2345: UDP, length 15
14:22:36.469309 IP localhost.45277 > localhost.2345: UDP, length 15
14:22:36.469312 IP localhost.45277 > localhost.2345: UDP, length 15
14:22:36.469315 IP localhost.45277 > localhost.2345: UDP, length 15
14:22:36.469319 IP localhost.45277 > localhost.2345: UDP, length 15
14:22:36.469322 IP localhost.45277 > localhost.2345: UDP, length 15
14:22:36.469325 IP localhost.45277 > localhost.2345: UDP, length 15
14:22:36.469334 IP localhost.45277 > localhost.2345: UDP, length 15
14:22:36.469337 IP localhost.45277 > localhost.2345: UDP, length 15
14:22:36.469341 IP localhost.45277 > localhost.2345: UDP, length 15
14:22:36.469344 IP localhost.45277 > localhost.2345: UDP, length 15
14:22:36.469347 IP localhost.45277 > localhost.2345: UDP, length 15
14:22:36.469350 IP localhost.45277 > localhost.2345: UDP, length 15
14:22:36.469353 IP localhost.45277 > localhost.2345: UDP, length 15
14:22:36.469356 IP localhost.45277 > localhost.2345: UDP, length 15
14:22:36.469359 IP localhost.45277 > localhost.2345: UDP, length 15
14:22:36.469363 IP localhost.45277 > localhost.2345: UDP, length 15
14:22:36.469366 IP localhost.45277 > localhost.2345: UDP, length 15
14:22:36.469369 IP localhost.45277 > localhost.2345: UDP, length 15
14:22:36.469372 IP localhost.45277 > localhost.2345: UDP, length 15
14:22:36.469375 IP localhost.45277 > localhost.2345: UDP, length 15
14:22:36.469379 IP localhost.45277 > localhost.2345: UDP, length 15
14:22:36.469383 IP localhost.45277 > localhost.2345: UDP, length 15
14:22:36.469386 IP localhost.45277 > localhost.2345: UDP, length 15
14:22:36.469389 IP localhost.45277 > localhost.2345: UDP, length 15
14:22:36.469392 IP localhost.45277 > localhost.2345: UDP, length 15
14:22:36.469396 IP localhost.45277 > localhost.2345: UDP, length 15
14:22:36.469399 IP localhost.45277 > localhost.2345: UDP, length 15
14:22:36.469402 IP localhost.45277 > localhost.2345: UDP, length 15
14:22:36.469405 IP localhost.45277 > localhost.2345: UDP, length 15
14:22:36.469409 IP localhost.45277 > localhost.2345: UDP, length 15
14:22:36.469412 IP localhost.45277 > localhost.2345: UDP, length 15
14:22:36.469415 IP localhost.45277 > localhost.2345: UDP, length 15
14:22:36.469418 IP localhost.45277 > localhost.2345: UDP, length 15
14:22:36.469422 IP localhost.45277 > localhost.2345: UDP, length 15
14:22:36.469425 IP localhost.45277 > localhost.2345: UDP, length 15
14:22:36.469429 IP localhost.45277 > localhost.2345: UDP, length 15
14:22:36.469432 IP localhost.45277 > localhost.2345: UDP, length 15
14:22:36.469435 IP localhost.45277 > localhost.2345: UDP, length 15
14:22:36.469438 IP localhost.45277 > localhost.2345: UDP, length 15
14:22:36.469441 IP localhost.45277 > localhost.2345: UDP, length 15
14:22:36.469445 IP localhost.45277 > localhost.2345: UDP, length 15
14:22:36.469448 IP localhost.45277 > localhost.2345: UDP, length 15
14:22:36.469451 IP localhost.45277 > localhost.2345: UDP, length 15
14:22:36.469455 IP localhost.45277 > localhost.2345: UDP, length 15
14:22:36.469458 IP localhost.45277 > localhost.2345: UDP, length 15
14:22:36.469461 IP localhost.45277 > localhost.2345: UDP, length 15
14:22:36.469464 IP localhost.45277 > localhost.2345: UDP, length 15
14:22:36.469467 IP localhost.45277 > localhost.2345: UDP, length 15
14:22:36.469470 IP localhost.45277 > localhost.2345: UDP, length 15
14:22:36.469473 IP localhost.45277 > localhost.2345: UDP, length 15
14:22:36.469476 IP localhost.45277 > localhost.2345: UDP, length 15
14:22:36.469480 IP localhost.45277 > localhost.2345: UDP, length 15
14:22:36.469483 IP localhost.45277 > localhost.2345: UDP, length 15
14:22:36.469487 IP localhost.45277 > localhost.2345: UDP, length 15
14:22:36.469490 IP localhost.45277 > localhost.2345: UDP, length 15
14:22:36.469493 IP localhost.45277 > localhost.2345: UDP, length 15
14:22:36.469497 IP localhost.45277 > localhost.2345: UDP, length 15
14:22:36.469500 IP localhost.45277 > localhost.2345: UDP, length 15
14:22:36.469503 IP localhost.45277 > localhost.2345: UDP, length 15
14:22:36.469506 IP localhost.45277 > localhost.2345: UDP, length 15
14:22:36.469510 IP localhost.45277 > localhost.2345: UDP, length 15
14:22:36.469513 IP localhost.45277 > localhost.2345: UDP, length 15
14:22:36.469516 IP localhost.45277 > localhost.2345: UDP, length 15
14:22:36.469519 IP localhost.45277 > localhost.2345: UDP, length 15
14:22:36.469523 IP localhost.45277 > localhost.2345: UDP, length 15
14:22:36.469526 IP localhost.45277 > localhost.2345: UDP, length 15
14:22:36.469529 IP localhost.45277 > localhost.2345: UDP, length 15
14:22:36.469532 IP localhost.45277 > localhost.2345: UDP, length 15
14:22:36.469535 IP localhost.45277 > localhost.2345: UDP, length 15
14:22:36.469539 IP localhost.45277 > localhost.2345: UDP, length 15
14:22:36.469542 IP localhost.45277 > localhost.2345: UDP, length 15
14:22:36.469545 IP localhost.45277 > localhost.2345: UDP, length 15
14:22:36.469548 IP localhost.45277 > localhost.2345: UDP, length 15
14:22:36.469551 IP localhost.45277 > localhost.2345: UDP, length 15
14:22:36.469555 IP localhost.45277 > localhost.2345: UDP, length 15
14:22:36.469558 IP localhost.45277 > localhost.2345: UDP, length 15
14:22:36.469561 IP localhost.45277 > localhost.2345: UDP, length 15
14:22:36.469564 IP localhost.45277 > localhost.2345: UDP, length 15
14:22:36.469567 IP localhost.45277 > localhost.2345: UDP, length 15
14:22:36.469571 IP localhost.45277 > localhost.2345: UDP, length 15
14:22:36.469574 IP localhost.45277 > localhost.2345: UDP, length 15
14:22:36.469577 IP localhost.45277 > localhost.2345: UDP, length 15
14:22:36.469581 IP localhost.45277 > localhost.2345: UDP, length 15
14:22:36.469584 IP localhost.45277 > localhost.2345: UDP, length 15
14:22:36.469587 IP localhost.45277 > localhost.2345: UDP, length 15
14:22:36.469590 IP localhost.45277 > localhost.2345: UDP, length 15
14:22:36.469593 IP localhost.45277 > localhost.2345: UDP, length 15
14:22:36.469597 IP localhost.45277 > localhost.2345: UDP, length 15
14:22:36.469600 IP localhost.45277 > localhost.2345: UDP, length 15
14:22:36.469603 IP localhost.45277 > localhost.2345: UDP, length 15
14:22:36.469608 IP localhost.45277 > localhost.2345: UDP, length 15
14:22:36.469611 IP localhost.45277 > localhost.2345: UDP, length 15
14:22:36.469615 IP localhost.45277 > localhost.2345: UDP, length 15
14:22:36.469618 IP localhost.45277 > localhost.2345: UDP, length 15
14:22:36.469623 IP localhost.45277 > localhost.2345: UDP, length 15
14:22:36.469627 IP localhost.45277 > localhost.2345: UDP, length 15
14:22:36.469630 IP localhost.45277 > localhost.2345: UDP, length 15
14:22:36.469634 IP localhost.45277 > localhost.2345: UDP, length 15
14:22:36.469640 IP localhost.45277 > localhost.2345: UDP, length 15
14:22:36.469643 IP localhost.45277 > localhost.2345: UDP, length 15
14:22:36.469647 IP localhost.45277 > localhost.2345: UDP, length 15
14:22:36.469650 IP localhost.45277 > localhost.2345: UDP, length 15
14:22:36.469656 IP localhost.45277 > localhost.2345: UDP, length 15
14:22:36.469660 IP localhost.45277 > localhost.2345: UDP, length 15
14:22:36.469663 IP localhost.45277 > localhost.2345: UDP, length 15
14:22:36.469666 IP localhost.45277 > localhost.2345: UDP, length 15
14:22:36.469673 IP localhost.45277 > localhost.2345: UDP, length 15
14:22:36.469677 IP localhost.45277 > localhost.2345: UDP, length 15
14:22:36.469680 IP localhost.45277 > localhost.2345: UDP, length 15
14:22:36.469683 IP localhost.45277 > localhost.2345: UDP, length 15
14:22:36.469687 IP localhost.45277 > localhost.2345: UDP, length 15
14:22:36.469690 IP localhost.45277 > localhost.2345: UDP, length 15
14:22:36.469693 IP localhost.45277 > localhost.2345: UDP, length 15
14:22:36.469696 IP localhost.45277 > localhost.2345: UDP, length 15
14:22:36.469700 IP localhost.45277 > localhost.2345: UDP, length 15
14:22:36.469703 IP localhost.45277 > localhost.2345: UDP, length 15
14:22:36.469706 IP localhost.45277 > localhost.2345: UDP, length 15
14:22:36.469709 IP localhost.45277 > localhost.2345: UDP, length 15
14:22:36.469712 IP localhost.45277 > localhost.2345: UDP, length 15
14:22:36.469715 IP localhost.45277 > localhost.2345: UDP, length 15
14:22:36.469719 IP localhost.45277 > localhost.2345: UDP, length 15
14:22:36.469722 IP localhost.45277 > localhost.2345: UDP, length 15
14:22:36.469725 IP localhost.45277 > localhost.2345: UDP, length 15
14:22:36.469729 IP localhost.45277 > localhost.2345: UDP, length 15
14:22:36.469733 IP localhost.45277 > localhost.2345: UDP, length 15
14:22:36.469736 IP localhost.45277 > localhost.2345: UDP, length 15
14:22:36.469739 IP localhost.45277 > localhost.2345: UDP, length 15
14:22:36.469742 IP localhost.45277 > localhost.2345: UDP, length 15
14:22:36.469745 IP localhost.45277 > localhost.2345: UDP, length 15
14:22:36.469748 IP localhost.45277 > localhost.2345: UDP, length 15
14:22:36.469751 IP localhost.45277 > localhost.2345: UDP, length 15
14:22:36.469755 IP localhost.45277 > localhost.2345: UDP, length 15
14:22:36.469758 IP localhost.45277 > localhost.2345: UDP, length 15
14:22:36.469763 IP localhost.45277 > localhost.2345: UDP, length 15
14:22:36.469766 IP localhost.45277 > localhost.2345: UDP, length 15
14:22:36.469770 IP localhost.45277 > localhost.2345: UDP, length 15
14:22:36.469773 IP localhost.45277 > localhost.2345: UDP, length 15
14:22:36.469781 IP localhost.45277 > localhost.2345: UDP, length 15
14:22:36.469784 IP localhost.45277 > localhost.2345: UDP, length 15
14:22:36.469787 IP localhost.45277 > localhost.2345: UDP, length 15
14:22:36.469793 IP localhost.45277 > localhost.2345: UDP, length 15
14:22:36.469797 IP localhost.45277 > localhost.2345: UDP, length 15
